{
  "schema_version": "1.0",
  "room_id": "act1_shattered_throne",
  "display_name": "The Shattered Throne",
  "act": "act1_shattered_keep",
  "room_type": "boss_arena",
  "width": 40,
  "height": 30,
  "shape": {
    "type": "rectangle"
  },
  "floor": {
    "default_material": "granite",
    "zones": [
      {
        "material": "rift",
        "rect": {
          "x": 16,
          "y": 11,
          "width": 8,
          "height": 8
        },
        "blend_edges": true
      }
    ],
    "accents": [
      {
        "material": "rift",
        "x": 12,
        "y": 15
      },
      {
        "material": "rift",
        "x": 28,
        "y": 15
      },
      {
        "material": "rift",
        "x": 20,
        "y": 7
      },
      {
        "material": "rift",
        "x": 20,
        "y": 23
      }
    ]
  },
  "walls": [
    {
      "prefab": "throne_dais",
      "x": 20,
      "y": 25,
      "rotation": 0
    },
    {
      "prefab": "column_hero",
      "x": 5,
      "y": 5,
      "rotation": 0
    },
    {
      "prefab": "column_hero",
      "x": 35,
      "y": 5,
      "rotation": 90
    },
    {
      "prefab": "column_hero",
      "x": 5,
      "y": 25,
      "rotation": 270
    },
    {
      "prefab": "column_hero",
      "x": 35,
      "y": 25,
      "rotation": 180
    },
    {
      "prefab": "column_broken",
      "x": 12,
      "y": 12,
      "rotation": 0
    },
    {
      "prefab": "column_broken",
      "x": 28,
      "y": 12,
      "rotation": 90
    },
    {
      "prefab": "column_broken",
      "x": 12,
      "y": 18,
      "rotation": 270
    },
    {
      "prefab": "column_broken",
      "x": 28,
      "y": 18,
      "rotation": 180
    }
  ],
  "props": [
    {
      "prefab": "banner_tattered",
      "x": 3,
      "y": 28
    },
    {
      "prefab": "banner_tattered",
      "x": 37,
      "y": 28
    },
    {
      "prefab": "rubble_pile_large",
      "x": 8,
      "y": 20
    },
    {
      "prefab": "rubble_pile_large",
      "x": 32,
      "y": 20
    },
    {
      "prefab": "skull_pile",
      "x": 10,
      "y": 8
    },
    {
      "prefab": "skull_pile",
      "x": 30,
      "y": 8
    }
  ],
  "mob_spawns": [
    {
      "mob_id": "act1_boss_shattered_king",
      "x": 20,
      "y": 24,
      "wave": 1,
      "elite": true
    }
  ],
  "doors": [
    {
      "direction": "south",
      "x": 20,
      "y": 1,
      "target_room_id": "act1_north_antechamber",
      "target_spawn_point": "from_north",
      "locked_initial": true
    }
  ],
  "spawn_points": [
    {
      "id": "from_south",
      "x": 20,
      "y": 3
    }
  ],
  "camera_bounds": {
    "x_min": 0,
    "x_max": 40,
    "y_min": 0,
    "y_max": 30
  },
  "lighting": {
    "global_color": "#16191F",
    "global_intensity": 0.5,
    "point_lights": [
      {
        "x": 20,
        "y": 15,
        "color": "#5DEFFF",
        "intensity": 2.2,
        "outer_radius": 9,
        "flicker": false
      },
      {
        "x": 5,
        "y": 25,
        "color": "#FFA060",
        "intensity": 1.0,
        "outer_radius": 4,
        "flicker": true
      },
      {
        "x": 35,
        "y": 25,
        "color": "#FFA060",
        "intensity": 1.0,
        "outer_radius": 4,
        "flicker": true
      }
    ]
  },
  "audio": {
    "music_track_id": "act1_boss_theme",
    "ambient_loop_id": "rift_throne_pulse"
  },
  "narrative": {
    "lore_note_id": "act1_boss_intro_monologue"
  }
}
