{
  "schema_version": "1.0",
  "room_id": "act1_treasure_vault",
  "display_name": "Treasure Vault",
  "act": "act1_shattered_keep",
  "room_type": "treasure",
  "width": 16,
  "height": 12,
  "shape": {
    "type": "rectangle"
  },
  "floor": {
    "default_material": "granite",
    "zones": [
      {
        "material": "rift",
        "rect": {
          "x": 7,
          "y": 5,
          "width": 2,
          "height": 2
        }
      }
    ]
  },
  "walls": [
    {
      "prefab": "column_hero",
      "x": 3,
      "y": 3,
      "rotation": 0
    },
    {
      "prefab": "column_hero",
      "x": 12,
      "y": 3,
      "rotation": 90
    },
    {
      "prefab": "column_hero",
      "x": 3,
      "y": 8,
      "rotation": 270
    },
    {
      "prefab": "column_hero",
      "x": 12,
      "y": 8,
      "rotation": 180
    }
  ],
  "props": [
    {
      "prefab": "banner_tattered",
      "x": 1,
      "y": 11
    },
    {
      "prefab": "banner_tattered",
      "x": 14,
      "y": 11
    }
  ],
  "mob_spawns": [
    {
      "mob_id": "shattered_knight",
      "x": 8,
      "y": 6,
      "wave": 1,
      "elite": true
    }
  ],
  "doors": [
    {
      "direction": "west",
      "x": 1,
      "y": 6,
      "target_room_id": "act1_east_corridor",
      "target_spawn_point": "from_east",
      "locked_initial": true
    }
  ],
  "spawn_points": [
    {
      "id": "from_west",
      "x": 2,
      "y": 6
    }
  ],
  "camera_bounds": {
    "x_min": 0,
    "x_max": 16,
    "y_min": 0,
    "y_max": 12
  },
  "lighting": {
    "global_color": "#2D2A1F",
    "global_intensity": 0.7,
    "point_lights": [
      {
        "x": 8,
        "y": 6,
        "color": "#FFD080",
        "intensity": 1.5,
        "outer_radius": 5,
        "flicker": false
      }
    ]
  },
  "audio": {
    "music_track_id": "act1_treasure_reveal",
    "ambient_loop_id": "silence_treasure"
  },
  "rewards": {
    "chests": [
      {
        "tier": "rare",
        "x": 8,
        "y": 6
      }
    ]
  }
}
