{
  "schema_version": "1.0",
  "room_id": "act1_east_corridor",
  "display_name": "East Corridor — Hairline Rift",
  "act": "act1_shattered_keep",
  "room_type": "corridor_linear",
  "width": 8,
  "height": 24,
  "shape": {
    "type": "rectangle"
  },
  "floor": {
    "default_material": "walkway",
    "accents": [
      {
        "material": "rift",
        "x": 4,
        "y": 6
      },
      {
        "material": "rift",
        "x": 4,
        "y": 12
      },
      {
        "material": "rift",
        "x": 4,
        "y": 18
      }
    ]
  },
  "walls": [],
  "props": [
    {
      "prefab": "torch_wall",
      "x": 1,
      "y": 5
    },
    {
      "prefab": "torch_wall",
      "x": 6,
      "y": 12
    },
    {
      "prefab": "torch_wall",
      "x": 1,
      "y": 19
    },
    {
      "prefab": "rubble_pile_small",
      "x": 4,
      "y": 9
    }
  ],
  "mob_spawns": [
    {
      "mob_id": "rift_husk",
      "x": 4,
      "y": 8,
      "wave": 1,
      "patrol_path": [
        {
          "x": 2,
          "y": 8
        },
        {
          "x": 6,
          "y": 8
        }
      ]
    },
    {
      "mob_id": "rift_husk",
      "x": 4,
      "y": 16,
      "wave": 1,
      "patrol_path": [
        {
          "x": 2,
          "y": 16
        },
        {
          "x": 6,
          "y": 16
        }
      ]
    }
  ],
  "doors": [
    {
      "direction": "west",
      "x": 1,
      "y": 12,
      "target_room_id": "act1_entry_hall",
      "target_spawn_point": "from_east",
      "locked_initial": true
    },
    {
      "direction": "east",
      "x": 7,
      "y": 12,
      "target_room_id": "act1_treasure_vault",
      "target_spawn_point": "from_west",
      "locked_initial": true
    }
  ],
  "spawn_points": [
    {
      "id": "from_west",
      "x": 2,
      "y": 12
    },
    {
      "id": "from_east",
      "x": 6,
      "y": 12
    }
  ],
  "camera_bounds": {
    "x_min": 0,
    "x_max": 8,
    "y_min": 0,
    "y_max": 24
  },
  "lighting": {
    "global_color": "#1A1D24",
    "global_intensity": 0.5,
    "point_lights": [
      {
        "x": 1,
        "y": 5,
        "color": "#FFA060",
        "intensity": 1.0,
        "outer_radius": 3.5,
        "flicker": true
      },
      {
        "x": 6,
        "y": 12,
        "color": "#FFA060",
        "intensity": 1.0,
        "outer_radius": 3.5,
        "flicker": true
      },
      {
        "x": 1,
        "y": 19,
        "color": "#FFA060",
        "intensity": 1.0,
        "outer_radius": 3.5,
        "flicker": true
      }
    ]
  },
  "audio": {
    "music_track_id": "act1_combat_corridor",
    "ambient_loop_id": "wind_tight_corridor"
  }
}
